{
  "individualID": "VEOIBD-MSSMCHO-1234",
  "sex": "male",
  "ageDxYears": 12,
  "ancestryJewish": true,
  "perianalInvolvement": false,
  "diseaseBehaviorStricturing": "Unknown",
  "breastFed": "False",
  "familyHistory": "False",
  "smokingHistory": false,
  "householdSmokingHistory": true,
  "maternalSmokingHistory": "False",
  "consanguinity": "Unknown",
  "countryOfOrigin": "USA",
  "ethnicity": "Caucasian",
  "diagnosisPhenotype": "IBD",
  "diseaseLocation": "L4a",
  "otherDiagnosis": "None",
  "medicationAtDx": "None",
  "EIM": "Migraines",
  "surgicalHistory": "Laproscopic"
}
